{
  "$schema": "https://json-schema.org/draft/2020-12/schema",
  "$id": "https://letflow369.github.io/x/content/schema/substance-dossier-v1.schema.json",
  "title": "Let Flow 369 — Substance Dossier v1",
  "type": "object",
  "required": ["schemaVersion", "template", "slug", "document", "page"],
  "properties": {
    "schemaVersion": { "const": 1 },
    "template": { "const": "substance-dossier-v1" },
    "slug": { "type": "string", "pattern": "^[a-z0-9-]+$" },
    "document": {
      "type": "object",
      "required": ["lang", "title", "description", "canonical", "styles", "structuredData"],
      "properties": {
        "lang": { "type": "string" },
        "bodyId": { "type": "string" },
        "title": { "type": "string" },
        "description": { "type": "string" },
        "themeColor": { "type": "string" },
        "canonical": { "type": "string", "format": "uri" },
        "styles": { "type": "array", "items": { "type": "string" } },
        "headScripts": { "type": "array" },
        "structuredData": { "type": "object" }
      }
    },
    "page": {
      "type": "object",
      "required": ["skipLink", "breadcrumbs", "article", "backToTop", "postScripts"],
      "properties": {
        "breadcrumbs": { "type": "array", "minItems": 2 },
        "article": {
          "type": "object",
          "required": ["classes", "hero", "toc", "sections", "footer"],
          "properties": {
            "sections": {
              "type": "array",
              "minItems": 1,
              "items": {
                "type": "object",
                "required": ["id", "classes", "innerHtml"],
                "properties": {
                  "id": { "type": "string" },
                  "classes": { "type": "array", "items": { "type": "string" } },
                  "ariaLabelledBy": { "type": ["string", "null"] },
                  "innerHtml": { "type": "string" }
                }
              }
            }
          }
        }
      }
    }
  }
}
