{
  "schemaVersion": 1,
  "template": "substance-dossier-v1",
  "slug": "cbd",
  "document": {
    "lang": "pt-BR",
    "bodyId": "topo",
    "title": "CBD — Canabidiol: ciência, evidências, segurança e legislação | Let Flow 369",
    "description": "CBD (canabidiol): história, farmacologia, epilepsias, evidências para ansiedade, sono, dor e saúde mental, segurança, interações, regulamentação brasileira e limites científicos.",
    "themeColor": "#111614",
    "canonical": "https://letflow369.github.io/x/artigos/cbd.html",
    "openGraph": {
      "type": "article",
      "locale": "pt_BR",
      "siteName": "Let Flow 369",
      "title": "CBD — Canabidiol: ciência, evidências, segurança e legislação | Let Flow 369",
      "description": "Da descoberta química às aplicações médicas: o que a ciência realmente sabe — e ainda não sabe — sobre o canabidiol.",
      "url": "https://letflow369.github.io/x/artigos/cbd.html",
      "image": "https://letflow369.github.io/x/src/assets/images/og-let-flow-369.jpg",
      "imageWidth": "1200",
      "imageHeight": "630",
      "imageAlt": "Identidade visual do Let Flow 369"
    },
    "articleMeta": {
      "publishedTime": "2026-08-09",
      "modifiedTime": "2026-08-09",
      "section": "Farmacologia, neurologia e medicina baseada em evidências"
    },
    "twitter": {
      "card": "summary_large_image",
      "title": "CBD — Canabidiol | Let Flow 369",
      "description": "Evidências estabelecidas, áreas em investigação, segurança e regulamentação do canabidiol.",
      "image": "https://letflow369.github.io/x/src/assets/images/og-let-flow-369.jpg"
    },
    "favicon": "../src/assets/images/favicon-32.png?v=20260806-21",
    "appleTouchIcon": "../src/assets/images/apple-touch-icon.png?v=20260806-21",
    "manifest": "../site.webmanifest?v=20260806-21",
    "styles": [
      "https://fonts.googleapis.com/css2?family=Atkinson+Hyperlegible:ital,wght@0,400;0,700;1,400&family=Cormorant+Garamond:ital,wght@0,600;0,700;1,600&family=Cinzel+Decorative:wght@700&family=Inter:wght@500;600;700&family=Marcellus&family=Spectral:ital,wght@0,400;0,600;1,400&display=swap",
      "../src/styles/tokens.css?v=20260811-1",
      "../src/styles/base.css?v=20260807-30",
      "../src/styles/components/header.css?v=20260811-4",
      "../src/styles/home.css?v=20260807-30",
      "../src/styles/article.css?v=20260807-30",
      "../src/styles/components/evidence-tags.css?v=20260807-30",
      "../src/styles/integrative-practice.css?v=20260809-01",
      "../src/styles/components/substance-dossier.css?v=20260811-1",
      "../src/styles/cbd.css?v=20260811-2"
    ],
    "headScripts": [
      {
        "src": "../src/scripts/integrative-practice.js?v=20260809-01",
        "defer": true,
        "type": null
      }
    ],
    "structuredData": {
      "@context": "https://schema.org",
      "@type": "Article",
      "headline": "CBD — Canabidiol",
      "alternativeHeadline": "Da descoberta química às aplicações médicas: o que a ciência realmente sabe sobre o canabidiol",
      "datePublished": "2026-08-09",
      "dateModified": "2026-08-09",
      "inLanguage": "pt-BR",
      "author": {
        "@type": "Organization",
        "name": "Let Flow 369"
      },
      "publisher": {
        "@type": "Organization",
        "name": "Let Flow 369"
      },
      "image": "https://letflow369.github.io/x/src/assets/images/og-let-flow-369.jpg",
      "mainEntityOfPage": "https://letflow369.github.io/x/artigos/cbd.html",
      "about": [
        "Canabidiol",
        "CBD",
        "Cannabis sativa",
        "Epilepsia",
        "Dravet",
        "Lennox-Gastaut",
        "Esclerose tuberosa",
        "Farmacologia",
        "Anvisa"
      ]
    },
    "headTailStyles": [
      "../src/styles/content-network.css?v=20260810-1"
    ]
  },
  "page": {
    "skipLink": {
      "href": "#conteudo-principal",
      "label": "Ir para o conteúdo principal"
    },
    "readingProgress": true,
    "breadcrumbs": [
      {
        "label": "Início",
        "href": "../index.html"
      },
      {
        "label": "Substâncias, farmacologia e consciência",
        "href": "../assuntos/substancias-farmacologia-consciencia.html"
      },
      {
        "label": "CBD — Canabidiol",
        "current": true
      }
    ],
    "article": {
      "classes": [
        "cbd-article",
        "integrative-page",
        "substance-dossier"
      ],
      "dataIntegrativePage": true,
      "hero": {
        "id": "visao-geral",
        "classes": [
          "cbd-hero",
          "substance-hero"
        ],
        "innerHtml": "<div class=\"cbd-hero__inner substance-hero__inner\"><div class=\"cbd-hero__content\"><p class=\"section-kicker\">Farmacologia · neurologia · evidência clínica · segurança · regulação</p><h1>CBD — Canabidiol</h1><p class=\"cbd-hero__subtitle substance-hero__subtitle\">Da descoberta química às aplicações médicas: o que a ciência realmente sabe sobre o canabidiol.</p><p class=\"cbd-hero__intro substance-hero__intro\">O canabidiol é um dos principais fitocanabinoides encontrados em <em>Cannabis sativa</em>. Nas últimas décadas, tornou-se objeto de intensa pesquisa científica: há <strong>aplicações farmacêuticas estabelecidas em condições específicas</strong> e, ao mesmo tempo, uma grande quantidade de usos ainda experimentais ou insuficientemente demonstrados.<sup class=\"reference\"><a aria-label=\"Referência 3\" href=\"#ref-3\">3</a></sup></p><div aria-label=\"Características principais\" class=\"cbd-domain-list\"><span>Fitocanabinoide</span><span>Não intoxicante como o THC</span><span>Uso médico específico</span><span>Pesquisa em expansão</span></div><div class=\"hero-actions\"><a class=\"button button--primary\" href=\"#essencial\">Entenda o essencial</a><a class=\"button button--secondary\" href=\"#evidencias\">Ver evidências científicas</a></div><aside aria-label=\"Aviso editorial\" class=\"cbd-hero__notice substance-hero__notice\"><strong>Conteúdo educacional baseado em evidências</strong><p>Não substitui avaliação, diagnóstico ou prescrição médica. A página separa resultado clínico, hipótese experimental, produto farmacêutico e alegação comercial.</p></aside></div>\n<div class=\"cbd-hero__plate substance-hero__visual\"><div aria-label=\"Representação esquemática e não estrutural da molécula de canabidiol\" class=\"cbd-molecule\" role=\"img\"><svg aria-hidden=\"true\" viewbox=\"0 0 420 360\"><g><line class=\"bond\" x1=\"92\" x2=\"142\" y1=\"175\" y2=\"132\"></line><line class=\"bond\" x1=\"142\" x2=\"199\" y1=\"132\" y2=\"157\"></line><line class=\"bond\" x1=\"199\" x2=\"205\" y1=\"157\" y2=\"218\"></line><line class=\"bond\" x1=\"205\" x2=\"151\" y1=\"218\" y2=\"249\"></line><line class=\"bond\" x1=\"151\" x2=\"96\" y1=\"249\" y2=\"221\"></line><line class=\"bond\" x1=\"96\" x2=\"92\" y1=\"221\" y2=\"175\"></line><line class=\"bond\" x1=\"199\" x2=\"258\" y1=\"157\" y2=\"126\"></line><line class=\"bond\" x1=\"258\" x2=\"309\" y1=\"126\" y2=\"158\"></line><line class=\"bond\" x1=\"309\" x2=\"302\" y1=\"158\" y2=\"220\"></line><line class=\"bond\" x1=\"302\" x2=\"248\" y1=\"220\" y2=\"247\"></line><line class=\"bond\" x1=\"248\" x2=\"205\" y1=\"247\" y2=\"218\"></line><line class=\"bond--soft\" x1=\"108\" x2=\"146\" y1=\"184\" y2=\"151\"></line><line class=\"bond--soft\" x1=\"257\" x2=\"294\" y1=\"145\" y2=\"167\"></line><circle class=\"atom--oxygen\" cx=\"75\" cy=\"154\" r=\"9\"></circle><circle class=\"atom--oxygen\" cx=\"319\" cy=\"101\" r=\"9\"></circle><line class=\"bond\" x1=\"83\" x2=\"92\" y1=\"159\" y2=\"175\"></line><line class=\"bond\" x1=\"312\" x2=\"258\" y1=\"107\" y2=\"126\"></line><circle class=\"atom\" cx=\"151\" cy=\"249\" r=\"5\"></circle><circle class=\"atom\" cx=\"248\" cy=\"247\" r=\"5\"></circle><text class=\"formula\" x=\"122\" y=\"313\">C₂₁H₃₀O₂</text><text class=\"label\" x=\"111\" y=\"336\">canabidiol · esquema editorial</text></g></svg></div><div class=\"cbd-plate__caption\"><strong>Uma molécula, níveis de evidência muito diferentes</strong><span>Formulação · dose · indicação · segurança · qualidade</span></div></div></div>"
      },
      "preLayoutSections": [
        {
          "id": "essencial",
          "classes": [
            "cbd-quick",
            "substance-quick"
          ],
          "ariaLabelledBy": "essencial-titulo",